,user_id,recommendation
0,XbiKsujS_qxU3xsr0xUqmQ,"Portland Variety, Ginger & Onion Cuisine, Gonoe Sushi, Odd Seoul, Sharetea, Valens Restaurant, Napoli Centrale, Home Of The Brave, Hair of the Dog, Tosto Quickfire Pizza Pasta"
1,CjbfWpCRLbA-L_eS_ztd6Q,"Little Piggy's, Walkers Wine Bar & Grill, Copacabana Brazilian Steak House, Pasha Authentic Turkish Cuisine, A-Game Cafe, Sud Forno, Trattoria Nervosa, Sansotei, Dragon Pearl Buffet, Azyun Restaurant"
2,JrXC_MDp38BWwLn2SFdNsA,"Diana's Oyster Bar And Grill, Millie Cafe, Urban Herbivore, Kaka All You Can Eat, Philthy Philly's, Sushi Legend, New City Restaurant, Daldongnae, The Oxley, Second Cup"
3,CxDOIDnH8gp9KXzpBHJYXw,"Legend Pot, The Keg Steakhouse + Bar - Mansion, DM Chicken, Azyun Restaurant, Maple Yip Seafood Restaurant, J'adore Hot Pot, Honest Weight, Congee Town, GuangZhou Tai Ping Sha Chinese Restaurant, Green Tea Restaurant"
4,U1vl4SQzO3wTAWlYVnSjnw,"GaNaDaRa, Didar, Sushi Shop, Opiano, Serrano Bar-B-Q, Ô Claf, Cinko, Bocadillo, Five Guys, Maison Christian Faure"
5,wffnrXJoLppOlvNOZKU70A,"Souriana, Cafe Aunja, Takumi, Le Festin du Capitaine, Industria Pizzeria + Bar, Duc de Lorraine, The Keg Steakhouse + Bar - Place Ville Marie, Bâton Rouge, Pizzéria N° 900 Peel, Burger Bar Crescent"
6,tU94-C1zpBsfGFvpsJJr2w,"Boogies Burgers, Social Eatery, Greek Stop, Little Sheep Mongolian Hot Pot, Daldongnae, Colette Grand Cafe, Browns Socialhouse Erin Mills, JOEY Sherway, Cheers Chicken & Beers, Azyun Restaurant"
7,qKpkRCPk4ycbllTfFcRbNw,"Tejano, Café Martin, Eva B, Le Lab, Bâton Rouge, Monopole, Arriba Burrito, Le Majestique, Cantinho de Lisboa, Les Deux Gamins"
8,O3pSxv1SyHpY4qi4Q16KzA,"Bar Hop, The Captain's Boil, R&D Restaurant, The Senator, Lao Thai Restaurant, Rorschach Brewing Company, The Wren, Bellwoods Brewery, 3030, Indie Ale House"
9,Plqi4pG84PA_vBM8OfDPDg,"Onnki Donburi, TORCH Pressed Sushi, The Good Fork, Beast, Bloomer's, The Shore Club - Toronto, Chabrol Restaurant, The Keg Steakhouse + Bar - York Street, The Wren, Barberian's Steak House"
10,Ao-6FYE29-I8WwPg67806A,"TYC - The Yellow Chilli - By Sanjeev Kapoor, Top Choice Restaurant, Go Topoki, Holy Chuck, Stock In Trade, Maezo - Modern Indian Cuisine, Daldongnae, KINTON RAMEN, Li Dynasty Indian Hakka Chinese Cuisine, Saryo Cafe"
11,jpIGlAym6z88W2xzHiK5_A,"Punjabi Sweet House & Restaurant, Thomsons Restaurant, La Chaumiere Restaurant, LOCAL Public Eatery, Moxie's Grill & Bar, The Guild, Suzette Brittany Bistro, Aida's Mediterranean Bistro, Briggs Kitchen + Bar, Cibo"
12,PGeiszoVusiv0wTHVdWklA,"Masseria, Korean Village Restaurant, Luna Cafe, Farmhouse Tavern, Uncle Mikey's, Odd Seoul, Porchetta & Co, Northern Belle, Branca, Forget Me Not Cafe"
13,U5YQX_vMl_xQy8EQDqlNQQ,"Stoney's Bread Company, Sushi 2 Go, The WORKS Gourmet Burger Bistro, Hey Lucy, Kovalsky Restaurant, Scaddabush Italian Kitchen & Bar, Huevos Gourmet, Luca Pizza, 17 Steakhouse and Bar, Sansotei Ramen"
14,XrYTMhY9YJvzX2pMepIz7A,"Banh Mi Ba Le, Nando's, Electric Mud BBQ, Revitasize, Cups Bingsu Café, Birch Bistro, Baklawa King, Zavida Coffee Roasters, Mr ChiMaek, Azyun Restaurant"
15,orh0HRUNCWuQMt9Iia_osg,"Remezzo Italian Bistro, Cafe de Causette, Original Congee, Green Tea Restaurant, Lac Vien Vietnamese Restaurant, Szechuan Legend, Kenny's Noodle, Kaka All You Can Eat, Tasty BBQ Seafood Restaurant, Sam's Congee Delight"
16,CQ67NJigSe5-uBDX3b_CUw,"Xe Lua Restaurant, The Royal Chinese Restaurant, Nami Restaurant, Tofu Village - House of Soon Tofu, Ten23, Chatime - Dundas, Raijin Ramen, Naniwa-Taro, Sansotei, Riddle Room"
17,jwctwzboGhQmtC50Juxa9A,"iQ Food, Mother's Dumplings, Toast Delight, MINE Sushi, New City Restaurant, Flaming Kitchen, CoCo Fresh Tea & Juice Richmond Hill, Satay Sate, Kaka All You Can Eat, Azyun Restaurant"
18,TibBhm-fbksozIDFD8wjPQ,"Actinolite Restaurant, Bapbo Korean Restaurant, Hemingway's Restaurant, Tosto Quickfire Pizza Pasta, Fresh on Spadina, Vietnam Lovely Noodle, Chez Tousignant, Boar, Té, Rasa"
19,ic-tyi1jElL_umxZVh8KNA,"Gohyang Restaurant, Five Guys, Milestones Restaurants, Maurya East Indian Roti, Woody's Burger Bar and Grill, Bua Thai Cusine, The Pie Commission, 850 Degrees Pizzeria, Simon Sushi, K&B Sushi"
20,uz5-sq6wHrXScrIWb8r1Mg,"Si Lom Thai Bistro, Vietnam Lovely Noodle, Tiger BBQ, Azyun Restaurant, Morals Village, Papa Spicy, Saryo Cafe, Bannock, Go Topoki, Sukho Thai"
21,LB5ViGU59ww2XRCx803t0w,"Kiku, Get & Go Buritto, Pizza Pizza, Sultan of Samosas, Coffee Culture, Burrito Boyz, Subway, Chung Moi, Honey B Hives Restaurant, Kandahar Kabab"
22,8Dvr-U6jCZTVGD52LwC2qA,"Sushi Shop, Gonoe Sushi, Saryo Cafe, Lohas Cafe, Tapagria Spanish Tapas, Mr Tonkatsu, Light Cafe, Matsuya Korean House, STACK, Naniwa-Taro"
23,eZeBuiVZWT7u3SktO7mv9w,"Ai Sushi, Gyugyuya, PaPa Chang's, Light Cafe, Oriental Rice Noodle, Azyun Restaurant, New City Restaurant, Versus Coffee, BlackGold Cafe, Cho Sun Ok"
24,Z09rco1enQXNCd9H0u7kvg,"Golden Bubbles, Sultan of Samosas, Allwyn's Bakery, Swiss Chalet Rotisserie & Grill, McDonald's, Sunny Up All Day Breakfast, Kaka All You Can Eat, Eggsmart, Samosa King - Embassy Restaurant, Azyun Restaurant"
25,g-y4Me4bqDz8jwFzX_e17w,"Bâton Rouge, Over Easy Restaurant, 4 Origines, Banh Mi Boys, Brit & Chips, Boustan, Brit & Chips, Hinnawi Bros Begal & Café, Gus, Chatime"
26,O3q-nwYZykMmacxjru01Zg,"Smoque N' Bones, Izakaya Ju, Kaka All You Can Eat, Tendou Matcha & Dessert, Poke Eats, O.Noir, Nando's Flame Grilled Chicken, Azyun Restaurant, Woodstone Eatery, Barsa Taberna"
27,Zd3wzNdevk15CwMIJdbjZw,"The Porch Toronto, Craft Beer Market, Goat Coffee Co, Live Organic Food Bar, Veda Healthy IndianTakeout, Sake Bar Kushi, Levetto, The Big Carrot, Urban Herbivore, Té"
28,3aYeG-x5A44GIgmBHrwyAA,"Les Affamés, Fromagerie Qui Lait Cru, Darling, Flyjin, Le Butterblume, Barbounya, HarBin Dumpling, Chez Claudette, Saint-Houblon, Bristol Chai"
29,pn_flI3EBNugBEYFp9okxQ,"Moxie's Grill & Bar, Chick Fiesta, Mayur Fine Indian Cuisine, Christina's On the Danforth, Lamanna's Bakery, East Tea Can, Nakamori, Aoyama Sushi Restaurant, Jerusalem Restaurant, Hamish Kitchen Restaurant"
30,Kj9cFO70zZOQorN0mgeLWA,"L'Oeufrier, SuWu, Kintaro Izakaya, Grey Gardens, Annette Food Market, The Citizen, Mitzi's Café, Le Majestique, El Catrin Destileria, Her Father's Cider Bar & Kitchen"
31,Nq6e5N8bjgD9B46O4va_zA,"Labothéry, The Pie Commission, St-Viateur Bagel & Café, Wonton Chai Noodle, Lime Asian Cuisine, Menya Fuji, Sugar Marmalade, Myungdong Kalguksu, Jules Bistro, Bosk"
32,yphnJ8zYbJF7Y3QbtMj91g,"La Graine Brûlée, Maison Christian Faure, Café Melbourne, Pizzeria Dei Compari, Centrale Bergham, C'ChoColat, Les Impertinentes, Moishe's Steakhouse, Cookie Stéfanie, Ottavio"
33,iRQ_YKpCBdaCwvc2X8_3NQ,"Indian Grill, Banjara Indian Cuisine, Pinky's Ca Phe, Rose and Sons Swan, Anatolia Restaurant, Mother's Dumplings, Restaurant La Banane, Mitzie's Jerk, Bacchus Roti Shop, La Chilaca Taqueria"
34,hFvLG_m26hYMx1UGQSpaEg,"Pho Hoa 89, Morals Village Hot pot, Pita & Grill, Pho Vuho, Mamma Martino's Pasta and Pizzeria Restaurant, Oyster Boy, L.A. Boil Seafood, Nations Fresh Foods, Basil Box, Kenzo Ramen"
35,aX6_Pf3njB-H3FrqgnNJ2g,"3030, Sky Dragon Chinese Restaurant, Sansotei, Kenzo Ramen, Thai Fantasy, Yummy BBQ, Hot Star Large Fried Chicken, Phoenix Cafe, Saryo Cafe, Luckee"
36,0Zswwlz4NzUJoG-skyWzIw,"Fat Bastard Burrito, Eat Jackpot, Earls Kitchen + Bar, Sakawa Coffee & Japanese Restaurant, Wonton Chai Noodle, Mekong River, Shangrila Tibetan & Asian Cuisine, Tabülè Middle Eastern Cuisine, Saryo Cafe, Le Sélect Bistro"
37,vs8aSP9ArwqAlb0LeCnFeQ,"Union Chicken, Black Cat Espresso Bar, Chinese Dumpling House, Mr.Tonkatsu, HotBlack Coffee, Tabule Restaurant, Raijin Ramen, Nando's Flame Grilled Chicken, Eat Jackpot, Korean Village Restaurant"
